{
  "action": {
    "capability": "refund.execute",
    "name": "refund.create",
    "parameters": {
      "amount_minor": 1000,
      "currency": "USD"
    }
  },
  "audience": {
    "id": "protected-endpoint",
    "type": "service"
  },
  "category": "replay",
  "contract": {
    "name": "refusal",
    "version": "v1"
  },
  "correlation": {
    "action_hash": {
      "algorithm": "sha-256",
      "canonicalization": "RFC8785-JCS",
      "value": "a2df0ff9a688450b00509762f2624e027b3956f65a8fdf2a97987db2b2c5e186"
    },
    "escrow_id": "esc_sim_replay_001",
    "pccb_id": "pccb_sim_replay_001",
    "request_id": "req_sim_replay_001"
  },
  "details": {
    "existing_status": "consumed",
    "pccb_id": "pccb_sim_replay_001",
    "replay_key": "rpk_f53609345fb6211fe536c0d8414251bee6307aeb41b0f338b3f974c7d845a6a8"
  },
  "intent_id": "intent_sim_replay_001",
  "message": "The protected action has already been claimed for execution.",
  "refusal_code": "DUPLICATE_REPLAY",
  "refusal_id": "rfsl_sim_replay_001",
  "refused_at": "2026-01-01T12:00:00Z",
  "retryable": false,
  "subject": {
    "id": "actor_123",
    "type": "service"
  },
  "target": {
    "resource_id": "pay_001",
    "resource_type": "payment"
  },
  "tenant": {
    "tenant_id": "tenant_alpha"
  }
}
